{
  "$schema": "../../schemas/padrao-fabrica.schema.json",
  "id": "fab.exemplo",
  "nome": "Padrão de Fábrica Exemplo (valores de referência: calibrar com a fábrica e o gabarito Promob)",
  "versao": "0.1.0",
  "unidade": "mm",

  "arredondamento": { "corte": 0.5, "modo": "proximo" },
  "chapaPadrao": { "comprimento": 2750, "largura": 1850, "refilo": 10, "serra": 4 },

  "materiais": {
    "MDF18_BRANCO_TX": { "tipo": "chapa", "descricao": "MDF 18 mm Branco TX 2 faces", "espessura": 18, "veio": false, "fita": "FITA045_BRANCO_TX", "cor": "#EDEDE8" },
    "MDF15_BRANCO_TX": { "tipo": "chapa", "descricao": "MDF 15 mm Branco TX 2 faces", "espessura": 15, "veio": false, "fita": "FITA045_BRANCO_TX", "cor": "#EDEDE8" },
    "MDF18_FREIJO": { "tipo": "chapa", "descricao": "MDF 18 mm Freijó 2 faces", "espessura": 18, "veio": true, "fita": "FITA1_FREIJO", "cor": "#A47A52" },
    "HDF6_BRANCO": { "tipo": "chapa", "descricao": "HDF 6 mm Branco 1 face", "espessura": 6, "veio": false, "cor": "#F2F2F0" }
  },

  "fitas": {
    "FITA045_BRANCO_TX": { "descricao": "Fita PVC 0,45 x 22 Branco TX", "espessura": 0.45, "largura": 22 },
    "FITA1_FREIJO": { "descricao": "Fita PVC 1,0 x 22 Freijó", "espessura": 1, "largura": 22 }
  },

  "regrasFita": { "descontarNoCorte": true, "descontarAPartirDe": 1.0 },

  "acabamentos": {
    "estrutura": "MDF18_BRANCO_TX",
    "frente": "MDF18_FREIJO",
    "costa": "HDF6_BRANCO",
    "caixaGaveta": "MDF15_BRANCO_TX",
    "fundoGaveta": "HDF6_BRANCO"
  },

  "papeis": {
    "lateral": { "rotulo": "Lateral", "acabamento": "estrutura", "fitas": ["frente"], "grupoLista": "caixa" },
    "base": { "rotulo": "Base", "acabamento": "estrutura", "fitas": ["frente"], "grupoLista": "caixa" },
    "tampo": { "rotulo": "Tampo", "acabamento": "estrutura", "fitas": ["frente"], "grupoLista": "caixa" },
    "travessa": { "rotulo": "Travessa", "acabamento": "estrutura", "fitas": ["frente"], "grupoLista": "caixa" },
    "divisoria": { "rotulo": "Divisória", "acabamento": "estrutura", "fitas": ["frente"], "grupoLista": "caixa" },
    "costa": { "rotulo": "Costa", "acabamento": "costa", "fitas": [], "grupoLista": "caixa" },
    "rodape": { "rotulo": "Rodapé", "acabamento": "estrutura", "fitas": [], "grupoLista": "caixa" },
    "prateleira": { "rotulo": "Prateleira", "acabamento": "estrutura", "fitas": ["frente"], "grupoLista": "interno" },
    "frente_porta": { "rotulo": "Porta", "acabamento": "frente", "fitas": "todas", "grupoLista": "frentes" },
    "frente_gaveta": { "rotulo": "Frente de gaveta", "acabamento": "frente", "fitas": "todas", "grupoLista": "frentes" },
    "lateral_gaveta": { "rotulo": "Lateral de gaveta", "acabamento": "caixaGaveta", "fitas": ["cima"], "grupoLista": "gavetas" },
    "contrafrente_gaveta": { "rotulo": "Contrafrente de gaveta", "acabamento": "caixaGaveta", "fitas": ["cima"], "grupoLista": "gavetas" },
    "traseira_gaveta": { "rotulo": "Traseira de gaveta", "acabamento": "caixaGaveta", "fitas": ["cima"], "grupoLista": "gavetas" },
    "fundo_gaveta": { "rotulo": "Fundo de gaveta", "acabamento": "fundoGaveta", "fitas": [], "grupoLista": "gavetas" }
  },

  "folgas": {
    "frentes": { "entreFrentes": 3, "perimetro": 1.5, "embutidaPerimetro": 2 },
    "gavetas": { "traseira": 10, "fundoRebaixo": 8, "folgaAltura": 0 },
    "prateleiras": { "lateral": 1, "frontal": 20, "traseira": 2 }
  },

  "construcao": {
    "costa": { "tipo": "canal", "canalRecuo": 10, "canalProfundidade": 8, "canalFolga": 1 },
    "rodape": { "tipo": "nenhum" },
    "frentes": { "sobreposicaoExterna": 1, "sobreposicaoInterna": 0.5 }
  },

  "furacao": {
    "sistema32": { "recuoFrontal": 37, "passo": 32, "diametro": 5, "profundidade": 12, "margem": 64 },
    "minifix": { "distanciaBorda": 34, "diametroTambor": 15, "profundidadeTambor": 12.5, "diametroPino": 8, "profundidadePino": 11 },
    "cavilha": { "diametro": 8, "comprimento": 30, "profundidadeFace": 12, "profundidadeTopo": 20 },
    "dobradica": { "diametroCaneco": 35, "profundidadeCaneco": 12.5, "distanciaBorda": 22.5, "distanciaExtremo": 100 },
    "juncoes": {
      "lateral+base": "minifix_cavilha",
      "lateral+tampo": "minifix_cavilha",
      "lateral+travessa": "minifix_cavilha",
      "lateral+rodape": "cavilha",
      "lateral_gaveta+contrafrente_gaveta": "confirmat",
      "lateral_gaveta+traseira_gaveta": "confirmat"
    }
  },

  "ferragens": {
    "COR_TEL_250": { "categoria": "corredica", "descricao": "Corrediça telescópica 45 mm x 250 (par)", "unidade": "PAR", "comprimento": 250, "folgaLateral": 12.7 },
    "COR_TEL_300": { "categoria": "corredica", "descricao": "Corrediça telescópica 45 mm x 300 (par)", "unidade": "PAR", "comprimento": 300, "folgaLateral": 12.7 },
    "COR_TEL_350": { "categoria": "corredica", "descricao": "Corrediça telescópica 45 mm x 350 (par)", "unidade": "PAR", "comprimento": 350, "folgaLateral": 12.7 },
    "COR_TEL_400": { "categoria": "corredica", "descricao": "Corrediça telescópica 45 mm x 400 (par)", "unidade": "PAR", "comprimento": 400, "folgaLateral": 12.7 },
    "COR_TEL_450": { "categoria": "corredica", "descricao": "Corrediça telescópica 45 mm x 450 (par)", "unidade": "PAR", "comprimento": 450, "folgaLateral": 12.7 },
    "COR_TEL_500": { "categoria": "corredica", "descricao": "Corrediça telescópica 45 mm x 500 (par)", "unidade": "PAR", "comprimento": 500, "folgaLateral": 12.7 },
    "COR_TEL_550": { "categoria": "corredica", "descricao": "Corrediça telescópica 45 mm x 550 (par)", "unidade": "PAR", "comprimento": 550, "folgaLateral": 12.7 },
    "DOB_35_RETA": { "categoria": "dobradica", "descricao": "Dobradiça caneco 35 mm reta (sobreposição total) com amortecedor", "unidade": "PC", "sobreposicao": "total" },
    "DOB_35_CURVA": { "categoria": "dobradica", "descricao": "Dobradiça caneco 35 mm curva (meia sobreposição) com amortecedor", "unidade": "PC", "sobreposicao": "meia" },
    "DOB_35_SUPERCURVA": { "categoria": "dobradica", "descricao": "Dobradiça caneco 35 mm supercurva (embutida) com amortecedor", "unidade": "PC", "sobreposicao": "embutida" },
    "MINIFIX_15": { "categoria": "minifix", "descricao": "Minifix 15 mm (tambor + pino)", "unidade": "JG" },
    "CAVILHA_8x30": { "categoria": "cavilha", "descricao": "Cavilha 8 x 30 mm", "unidade": "PC" },
    "CONFIRMAT_7x50": { "categoria": "confirmat", "descricao": "Parafuso confirmat 7 x 50 mm", "unidade": "PC" },
    "SUP_PRAT_5": { "categoria": "suporte_prateleira", "descricao": "Suporte de prateleira pino 5 mm", "unidade": "PC" },
    "PE_REG_100": { "categoria": "pe", "descricao": "Pé regulável plástico 100 mm", "unidade": "PC", "modelo3d": "modelos3d/pe-regulavel-100.glb" },
    "PUX_128_INOX": { "categoria": "puxador", "descricao": "Puxador alça 128 mm inox escovado", "unidade": "PC", "entreFuros": 128, "modelo3d": "modelos3d/puxador-alca-128.glb" },
    "PUX_160_PRETO": { "categoria": "puxador", "descricao": "Puxador alça 160 mm preto fosco", "unidade": "PC", "entreFuros": 160, "modelo3d": "modelos3d/puxador-alca-160.glb" },
    "CANT_TAMPO": { "categoria": "fixacao", "descricao": "Cantoneira de fixação do tampo de pedra", "unidade": "PC" }
  },

  "tabelas": {
    "dobradicasPorAltura": {
      "descricao": "Número de dobradiças pela altura da porta (mm)",
      "linhas": [
        { "ate": 900, "valor": 2 },
        { "ate": 1600, "valor": 3 },
        { "ate": 2000, "valor": 4 },
        { "ate": 2600, "valor": 5 }
      ]
    },
    "alturaCaixaGaveta": {
      "descricao": "Altura da caixa da gaveta pela altura da frente (mm)",
      "linhas": [
        { "ate": 130, "valor": 70 },
        { "ate": 200, "valor": 110 },
        { "ate": 300, "valor": 160 },
        { "ate": 99999, "valor": 200 }
      ]
    }
  },

  "limites": {
    "portaLarguraMax": 600,
    "portaAlturaMax": 2400,
    "gavetaFrenteMin": 100,
    "prateleiraVaoMax": 900
  }
}
